{
  "schema": "retrieval-gold/v1",
  "id": "contract-drift",
  "scenario": "Contract versus implementation drift surfaced",
  "mode": "quality",
  "request": {
    "route": {
      "digest": "gold-route/v1",
      "status": "COMPLETE",
      "owners": [
        "fixture"
      ]
    },
    "sources": [
      {
        "identity": "fixture",
        "read_paths": [
          "."
        ]
      }
    ],
    "budget": {
      "max_source_bytes": 1048576,
      "max_context_tokens": 65536
    }
  },
  "expected": {
    "status": "PARTIAL",
    "must_find": [
      {
        "path": ".ai/contracts/public.yaml"
      },
      {
        "path": "source.go"
      }
    ],
    "required_contracts": [
      {
        "path": ".ai/contracts/public.yaml"
      }
    ],
    "authority_conflicts": [
      "GET /records"
    ]
  },
  "candidates": [
    {
      "relative_path": ".ai/contracts/public.yaml",
      "content": "GET /records expected",
      "evidence_kind": "contract",
      "query": "contract",
      "provenance": "TRUSTED_PROJECT_METADATA",
      "claim_type": "public_api_contract",
      "claim_key": "GET /records",
      "claim_value": "200",
      "required": true
    },
    {
      "relative_path": "source.go",
      "content": "actual implementation",
      "claim_key": "GET /records",
      "claim_value": "500",
      "required": true
    }
  ]
}
