{
  "schema": "retrieval-gold/v1",
  "id": "test-old-readme",
  "scenario": "Current test versus old README",
  "mode": "quality",
  "request": {
    "route": {
      "digest": "gold-route/v1",
      "status": "COMPLETE",
      "owners": [
        "fixture"
      ]
    },
    "sources": [
      {
        "identity": "fixture",
        "read_paths": [
          "."
        ]
      }
    ],
    "budget": {
      "max_source_bytes": 1048576,
      "max_context_tokens": 65536
    }
  },
  "expected": {
    "status": "PARTIAL",
    "must_find": [
      {
        "path": "source_test.go"
      }
    ],
    "must_not_find": [
      {
        "path": "README.md"
      }
    ],
    "authority_conflicts": [
      "behavior"
    ],
    "diagnostics": [
      "EVIDENCE_FRESHNESS_STALE"
    ]
  },
  "candidates": [
    {
      "relative_path": "source_test.go",
      "content": "Current executable assertion",
      "provenance": "PROJECT_TEST",
      "evidence_kind": "test",
      "claim_key": "behavior",
      "claim_value": "current"
    },
    {
      "relative_path": "README.md",
      "content": "High confidence old description",
      "provenance": "PROJECT_DOC",
      "freshness": "STALE",
      "claim_key": "behavior",
      "claim_value": "old"
    }
  ]
}
