{
  "schema": "retrieval-gold/v1",
  "id": "r1-symbol-clipping",
  "scenario": "R1 symbol match clipping",
  "mode": "routing_coverage",
  "request": {
    "route": {
      "digest": "gold-route/v1",
      "status": "COMPLETE",
      "owners": [
        "fixture"
      ]
    },
    "sources": [
      {
        "identity": "fixture",
        "read_paths": [
          "."
        ]
      }
    ],
    "budget": {
      "max_source_bytes": 1048576,
      "max_context_tokens": 65536
    },
    "task": "change business process"
  },
  "expected": {
    "status": "PARTIAL",
    "diagnostics": [
      "symbol_match_limit"
    ],
    "counters": {
      "symbols_omitted": 1
    },
    "incomplete_mandatory": true
  },
  "files": [
    {
      "path": "go.mod",
      "content": "module fixture\n"
    },
    {
      "path": "internal/domain/shape.go",
      "content": "package domain\n"
    },
    {
      "path": "internal/transport/shape.go",
      "content": "package transport\n"
    },
    {
      "path": "internal/infrastructure/shape.go",
      "content": "package infrastructure\n"
    },
    {
      "path": "internal/usecase/change.go",
      "content": "package usecase\nfunc Symbol0(){}\nfunc Symbol1(){}\nfunc Symbol2(){}\nfunc Symbol3(){}\nfunc Symbol4(){}\nfunc Symbol5(){}\nfunc Symbol6(){}\nfunc Symbol7(){}\nfunc Symbol8(){}\nfunc Symbol9(){}\nfunc Symbol10(){}\nfunc Symbol11(){}\nfunc Symbol12(){}\nfunc Symbol13(){}\nfunc Symbol14(){}\nfunc Symbol15(){}\nfunc Symbol16(){}\nfunc Symbol17(){}\nfunc Symbol18(){}\nfunc Symbol19(){}\nfunc Symbol20(){}\n"
    }
  ]
}
