{
  "schema": "retrieval-gold/v1",
  "id": "dirty-snapshot",
  "scenario": "Dirty snapshot remains explicit",
  "mode": "quality",
  "request": {
    "route": {
      "digest": "gold-route/v1",
      "status": "COMPLETE",
      "owners": [
        "fixture"
      ]
    },
    "sources": [
      {
        "identity": "fixture",
        "read_paths": [
          "."
        ],
        "dirty": true
      }
    ],
    "budget": {
      "max_source_bytes": 1048576,
      "max_context_tokens": 65536
    }
  },
  "expected": {
    "freshness": {"source.go": "DIRTY_SNAPSHOT"},
    "status": "COMPLETE",
    "must_find": [
      {
        "path": "source.go"
      }
    ]
  },
  "candidates": [
    {
      "relative_path": "source.go",
      "content": "Current dirty source"
    }
  ]
}
