{
  "schema": "retrieval-gold/v1",
  "id": "positive-route",
  "scenario": "Route polarity preserved: positive",
  "mode": "prepare",
  "request": {
    "route": {
      "digest": "gold-route/v1",
      "status": "COMPLETE",
      "owners": [
        "fixture"
      ],
      "constraints": [
        {
          "source_identity": "neighbor",
          "layer": "backend.infrastructure.persistence",
          "polarity": "positive",
          "decision": "selected"
        }
      ],
      "owner_review_required": false
    },
    "sources": [
      {
        "identity": "fixture",
        "read_paths": [
          "."
        ]
      }
    ],
    "budget": {
      "max_source_bytes": 1048576,
      "max_context_tokens": 65536
    },
    "required_facets": [
      {
        "id": "source",
        "kind": "source",
        "query_kind": "exact",
        "source_identity": "fixture",
        "path": "source.go",
        "claim_type": "implementation_behavior"
      }
    ]
  },
  "expected": {
    "status": "COMPLETE",
    "must_find": [
      {
        "path": "source.go"
      }
    ],
    "must_not_route_writes": [
      "neighbor"
    ]
  },
  "files": [
    {
      "path": "source.go",
      "content": "package sample\nfunc Target(){}\n"
    }
  ]
}
