{
  "schema": "retrieval-gold/v1",
  "id": "r1-unreadable",
  "scenario": "R1 unreadable required route source",
  "mode": "routing_coverage",
  "request": {
    "route": {
      "digest": "gold-route/v1",
      "status": "COMPLETE",
      "owners": [
        "fixture"
      ]
    },
    "sources": [
      {
        "identity": "fixture",
        "read_paths": [
          "."
        ]
      }
    ],
    "budget": {
      "max_source_bytes": 1048576,
      "max_context_tokens": 65536
    },
    "task": "change business process"
  },
  "expected": {
    "status": "PARTIAL",
    "diagnostics": [
      "read_error",
      "REQUIRED_NOT_VERIFIED"
    ],
    "counters": {
      "unreadable": 1
    },
    "incomplete_mandatory": true
  },
  "files": [
    {
      "path": "go.mod",
      "content": "module fixture\n"
    },
    {
      "path": "internal/domain/shape.go",
      "content": "package domain\n"
    },
    {
      "path": "internal/transport/shape.go",
      "content": "package transport\n"
    },
    {
      "path": "internal/infrastructure/shape.go",
      "content": "package infrastructure\n"
    },
    {
      "path": "internal/usecase/change.go",
      "content": "package usecase\nfunc Change(){}\n",
      "kind": "unreadable"
    }
  ]
}
