{
  "schema": "retrieval-gold/v1",
  "id": "nonregular",
  "scenario": "FIFO is never opened for content",
  "mode": "prepare",
  "request": {
    "route": {
      "digest": "gold-route/v1",
      "status": "COMPLETE",
      "owners": [
        "fixture"
      ]
    },
    "sources": [
      {
        "identity": "fixture",
        "read_paths": [
          "."
        ]
      }
    ],
    "budget": {
      "max_source_bytes": 1048576,
      "max_context_tokens": 65536
    },
    "required_facets": [
      {
        "id": "pipe",
        "kind": "source",
        "query_kind": "exact",
        "source_identity": "fixture",
        "path": "pipe.go",
        "claim_type": "implementation_behavior"
      }
    ]
  },
  "expected": {
    "status": "PARTIAL",
    "diagnostics": [
      "FILE_TYPE_EXCLUDED"
    ],
    "must_not_find": [
      {
        "path": "pipe.go"
      }
    ],
    "coverage": {
      "pipe": "EXCLUDED_BY_POLICY"
    }
  },
  "files": [
    {
      "path": "pipe.go",
      "content": "",
      "kind": "fifo"
    }
  ],
  "adversarial": true
}
