{
  "schema": "retrieval-gold/v1",
  "id": "unreadable",
  "scenario": "Required unreadable source cannot become absence",
  "mode": "prepare",
  "request": {
    "route": {
      "digest": "gold-route/v1",
      "status": "COMPLETE",
      "owners": [
        "fixture"
      ]
    },
    "sources": [
      {
        "identity": "fixture",
        "read_paths": [
          "."
        ]
      }
    ],
    "budget": {
      "max_source_bytes": 1048576,
      "max_context_tokens": 65536
    },
    "required_facets": [
      {
        "id": "source",
        "kind": "source",
        "query_kind": "exact",
        "source_identity": "fixture",
        "path": "source.go",
        "claim_type": "implementation_behavior"
      }
    ]
  },
  "expected": {
    "status": "PARTIAL",
    "diagnostics": [
      "UNREADABLE_SOURCE"
    ],
    "coverage": {
      "source": "UNREADABLE"
    },
    "incomplete_mandatory": true
  },
  "files": [
    {
      "path": "source.go",
      "content": "package sample\nfunc Target() {}\n",
      "kind": "unreadable"
    }
  ]
}
