{
  "schema": "retrieval-gold/v1",
  "id": "per-source-budget",
  "scenario": "Per-source budget cannot drop mandatory silently",
  "mode": "quality",
  "request": {
    "route": {
      "digest": "gold-route/v1",
      "status": "COMPLETE",
      "owners": [
        "fixture"
      ]
    },
    "sources": [
      {
        "identity": "fixture",
        "read_paths": [
          "."
        ]
      }
    ],
    "budget": {
      "max_source_bytes": 1048576,
      "max_context_tokens": 65536,
      "per_source_bytes": 3
    }
  },
  "expected": {
    "status": "BLOCKED",
    "diagnostics": [
      "BUDGET_UNSATISFIED"
    ],
    "evidence_count": 0,
    "incomplete_mandatory": true
  },
  "candidates": [
    {
      "relative_path": "source.go",
      "content": "required",
      "required": true
    }
  ]
}
