{
  "schema": "retrieval-gold/v1",
  "id": "expand-budget",
  "scenario": "Expansion budget is cumulative",
  "mode": "expand",
  "request": {
    "route": {
      "digest": "gold-route/v1",
      "status": "COMPLETE",
      "owners": [
        "fixture"
      ]
    },
    "sources": [
      {
        "identity": "fixture",
        "read_paths": [
          "."
        ]
      }
    ],
    "budget": {
      "max_source_bytes": 45,
      "max_context_tokens": 65536
    },
    "required_facets": [
      {
        "id": "source",
        "kind": "source",
        "query_kind": "exact",
        "source_identity": "fixture",
        "path": "source.go",
        "claim_type": "implementation_behavior"
      }
    ]
  },
  "expected": {
    "status": "BLOCKED",
    "diagnostics": [
      "BUDGET_UNSATISFIED"
    ],
    "must_find": [
      {
        "path": "source.go"
      }
    ],
    "must_not_find": [
      {
        "path": "extra.go"
      }
    ],
    "incomplete_mandatory": true
  },
  "files": [
    {
      "path": "source.go",
      "content": "package sample\nfunc Target() {}\n"
    },
    {
      "path": "extra.go",
      "content": "package sample\nfunc Extra() {}\n"
    }
  ],
  "expand": {
    "facet": {
      "id": "extra",
      "kind": "source",
      "query_kind": "definition",
      "source_identity": "fixture",
      "path": "extra.go",
      "claim_type": "implementation_behavior",
      "symbol": "Extra",
      "required": true
    },
    "reason": "Inspect exact dependency"
  }
}
