{
  "schema": "retrieval-gold/v1",
  "id": "r1-facts-overflow",
  "scenario": "R1 repository facts byte overflow",
  "mode": "routing_coverage",
  "request": {
    "route": {
      "digest": "gold-route/v1",
      "status": "COMPLETE",
      "owners": [
        "fixture"
      ]
    },
    "sources": [
      {
        "identity": "fixture",
        "read_paths": [
          "."
        ]
      }
    ],
    "budget": {
      "max_source_bytes": 1048576,
      "max_context_tokens": 65536
    },
    "task": "change business process"
  },
  "expected": {
    "status": "PARTIAL",
    "diagnostics": [
      "facts_bytes_limit"
    ],
    "counters": {
      "facts_omitted": 2
    },
    "incomplete_mandatory": true
  },
  "files": [
    {
      "path": "go.mod",
      "content": "module fixture\n"
    },
    {
      "path": "internal/domain/shape.go",
      "content": "package domain\n"
    },
    {
      "path": "internal/transport/shape.go",
      "content": "package transport\n"
    },
    {
      "path": "internal/infrastructure/shape.go",
      "content": "package infrastructure\n"
    },
    {
      "path": "AGENTS.md",
      "content": "a",
      "repeat": 98305
    },
    {
      "path": "internal/usecase/change.go",
      "content": "package usecase\nfunc Change(){}\n"
    }
  ]
}
