{
  "schema": "retrieval-gold/v1",
  "id": "owner-contract-route",
  "scenario": "Owner-only contract evidence does not create executor",
  "mode": "prepare",
  "request": {
    "route": {
      "digest": "gold-route/v1",
      "status": "COMPLETE",
      "owners": [
        "fixture"
      ],
      "constraints": [
        {
          "source_identity": "consumer",
          "layer": "backend.usecase",
          "polarity": "positive",
          "decision": "not_selected"
        }
      ]
    },
    "sources": [
      {
        "identity": "fixture",
        "read_paths": [
          "."
        ]
      }
    ],
    "budget": {
      "max_source_bytes": 1048576,
      "max_context_tokens": 65536
    },
    "required_facets": [
      {
        "id": "contract",
        "kind": "source",
        "query_kind": "contract",
        "source_identity": "fixture",
        "path": "contract.go",
        "claim_type": "public_api_contract"
      }
    ]
  },
  "expected": {
    "status": "COMPLETE",
    "must_find": [
      {
        "path": "contract.go",
        "kind": "contract"
      }
    ],
    "required_contracts": [
      {
        "path": "contract.go"
      }
    ],
    "must_not_route_writes": [
      "consumer"
    ]
  },
  "files": [
    {
      "path": "contract.go",
      "content": "package sample\ntype Port interface {Call()}\n"
    }
  ]
}
